{
  "bodyTypeName": "male",
  "url": "https://sanderfrenken.github.io/Universal-LPC-Spritesheet-Character-Generator/#?body=Body_color_light&head=Human_male_light&shoes=Boots_black&shield=Shield_crusader&weapon=Dagger_dagger",
  "spritesheets": "https://sanderfrenken.github.io/Universal-LPC-Spritesheet-Character-Generator/spritesheets/",
  "version": 1,
  "datetime": "3/28/2024, 12:00:05 PM",
  "credits": "Authors: bluecarrot16, Benjamin K. Smith (BenCreating), Evert, Eliza Wyatt (ElizaWy), TheraHedwig, MuffinElZangano, Durrani, Johannes Sj?lund (wulax), Stephen Challener (Redshrike), Nila122, Sander Frenken (castelonia), Johannes Sjölund (wulax), Matthew Krohn (makrohn)\n\n- body/bodies/male/universal/light.png: by bluecarrot16, Benjamin K. Smith (BenCreating), Evert, Eliza Wyatt (ElizaWy), TheraHedwig, MuffinElZangano, Durrani, Johannes Sj?lund (wulax), Stephen Challener (Redshrike). License(s): CC-BY-SA 3.0, GPL 3.0. \n    - https://opengameart.org/content/liberated-pixel-cup-lpc-base-assets-sprites-map-tiles\n    - https://opengameart.org/content/lpc-medieval-fantasy-character-sprites\n    - https://opengameart.org/content/lpc-male-jumping-animation-by-durrani\n    - https://opengameart.org/content/lpc-runcycle-and-diagonal-walkcycle\n    - https://opengameart.org/content/lpc-revised-character-basics\n\n- head/heads/human_male/universal/light.png: by bluecarrot16, Benjamin K. Smith (BenCreating), Stephen Challener (Redshrike). License(s): OGA-BY 3.0, CC-BY-SA 3.0, GPL 3.0. \n    - https://opengameart.org/content/liberated-pixel-cup-lpc-base-assets-sprites-map-tiles\n    - https://opengameart.org/content/lpc-character-bases\n\n- feet/boots/male/black.png: by bluecarrot16, Nila122. License(s): CC-BY-SA 3.0, GPL 2.0, GPL 3.0. \n    - https://opengameart.org/content/lpc-clothes-and-hair\n    - https://opengameart.org/content/lpc-santa\n    - http://opengameart.org/content/lpc-clothing-updates\n\n- shield/male/crusader.png: by bluecarrot16, Sander Frenken (castelonia). License(s): OGA-BY 3.0. \n    - https://opengameart.org/content/lpc-shields\n\n- weapon/sword/dagger/dagger.png: by bluecarrot16, Johannes Sjölund (wulax), Matthew Krohn (makrohn). License(s): CC-BY-SA 3.0, GPL 3.0. \n    - https://opengameart.org/content/lpc-medieval-fantasy-character-sprites\n    - https://opengameart.org/content/lpc-extended-weapon-animations\n\n- weapon/sword/dagger/behind/dagger.png: by bluecarrot16, Johannes Sjölund (wulax), Matthew Krohn (makrohn). License(s): CC-BY-SA 3.0, GPL 3.0. \n    - https://opengameart.org/content/lpc-medieval-fantasy-character-sprites\n    - https://opengameart.org/content/lpc-extended-weapon-animations",
  "layers": [
    {
      "fileName": "weapon/sword/dagger/behind/dagger.png",
      "zPos": 9,
      "parentName": "weapon",
      "name": "Dagger",
      "variant": "dagger"
    },
    {
      "fileName": "body/bodies/male/universal/light.png",
      "zPos": 10,
      "parentName": "body",
      "name": "Body color",
      "variant": "light"
    },
    {
      "fileName": "feet/boots/male/black.png",
      "zPos": 25,
      "parentName": "shoes",
      "name": "Boots",
      "variant": "black"
    },
    {
      "fileName": "head/heads/human_male/universal/light.png",
      "zPos": 100,
      "parentName": "head",
      "name": "Human male",
      "variant": "light"
    },
    {
      "fileName": "shield/male/crusader.png",
      "zPos": 110,
      "parentName": "shield",
      "name": "Shield",
      "variant": "crusader"
    },
    {
      "fileName": "weapon/sword/dagger/dagger.png",
      "zPos": 140,
      "parentName": "weapon",
      "name": "Dagger",
      "variant": "dagger"
    }
  ]
}
